{
  "schema_version": 1,
  "evidence_type": "oak-electron-runtime-provenance",
  "subject": {
    "name": "Electron",
    "version": "43.1.0",
    "target": {
      "platform": "win32",
      "arch": "x64"
    },
    "runtime_root": "node_modules/electron/dist",
    "runtime_lock": "config/tool-manifests/electron-43.1.0-win32-x64.json"
  },
  "official_release": {
    "publisher": "Electron maintainers",
    "release_page_url": "https://github.com/electron/electron/releases/tag/v43.1.0",
    "release_api_url": "https://api.github.com/repos/electron/electron/releases/tags/v43.1.0",
    "release_api_sha256": "aab2c6e1c35460de487aa9d2a561340cea99e21b72f22c773b13a0b84c15bf8b",
    "tag": "v43.1.0",
    "published_at": "2026-07-07T19:27:26Z",
    "artifact": {
      "url": "https://github.com/electron/electron/releases/download/v43.1.0/electron-v43.1.0-win32-x64.zip",
      "filename": "electron-v43.1.0-win32-x64.zip",
      "size_bytes": 144237574,
      "sha256": "a07dc1e3d5e589593d37e3b19d1b373e02bb58270e2eb0d6633eee0198ad09f0",
      "github_server_digest": "sha256:a07dc1e3d5e589593d37e3b19d1b373e02bb58270e2eb0d6633eee0198ad09f0"
    },
    "shasums": {
      "url": "https://github.com/electron/electron/releases/download/v43.1.0/SHASUMS256.txt",
      "size_bytes": 7610,
      "sha256": "5750c4c4964f9febf50a03a69a54b2a671e0a6520c3ea6b4500081d32cf53f13",
      "declared_artifact_sha256": "a07dc1e3d5e589593d37e3b19d1b373e02bb58270e2eb0d6633eee0198ad09f0",
      "filename_matches": true
    },
    "signature_status": "not_provided_as_release_asset"
  },
  "npm_package": {
    "package_lock_path": "package-lock.json",
    "resolved": "https://registry.npmjs.org/electron/-/electron-43.1.0.tgz",
    "integrity": "sha512-DPfxpQLd4NL3BJ8DBxYAfmLUKKesF5Rx9dQx5FyczAP8bhOPScjHE48GArVeXu68LlAainuwkmQTQvdZwpIIAQ==",
    "installed_package_json_sha256": "112071db9cf7c002f294bb517b840a865fc5a74acacb3a2c79ace6a45c010264",
    "installed_checksums_path": "node_modules/electron/checksums.json",
    "installed_checksums_sha256": "7c6faa41291ccd0db2cd73236ca80e6c82398812ad2cf2b9490fd9524c7d13c5",
    "artifact_digest_matches": true
  },
  "derivation": {
    "official_file_count": 75,
    "local_file_count": 75,
    "byte_identical_file_count": 75,
    "official_total_bytes": 364083658,
    "local_total_bytes": 364083658,
    "official_tree_sha256": "652e9b29f6f8f37b7d8d8beffb2eb5c149efb7afe54bcf65f1df7facadcc0462",
    "local_tree_sha256": "652e9b29f6f8f37b7d8d8beffb2eb5c149efb7afe54bcf65f1df7facadcc0462"
  },
  "redistribution": {
    "license_expression": "MIT",
    "runtime_license_path": "node_modules/electron/dist/LICENSE",
    "chromium_notices_path": "node_modules/electron/dist/LICENSES.chromium.html",
    "npm_license_path": "node_modules/electron/LICENSE",
    "license_materials_byte_identical": true,
    "human_signoff_required": true
  },
  "verification": {
    "machine_status": "verified",
    "human_review_status": "pending",
    "observed_at": "2026-07-28",
    "limitations": [
      "The release snapshot contains no detached-signature asset; GitHub server digest, SHASUMS256 and npm checksums were cross-checked instead.",
      "The official ZIP and installed runtime are byte-bound, but this is not an independent reproducible-build audit of Electron and Chromium sources.",
      "MIT, Chromium third-party notices, trademark and redistribution obligations still require named human sign-off before sale."
    ]
  },
  "official_files": [
    {
      "path": "LICENSE",
      "size_bytes": 1096,
      "sha256": "5154e165bd6c2cc0cfbcd8916498c7abab0497923bafcd5cb07673fe8480087d"
    },
    {
      "path": "LICENSES.chromium.html",
      "size_bytes": 20313957,
      "sha256": "b911161e6594ec76b872498b423c54406168f2974e0d407a847f7de1e5ff94dd"
    },
    {
      "path": "chrome_100_percent.pak",
      "size_bytes": 119905,
      "sha256": "d76fe8fa3a14cd73e4c858746e2ab2d2fa6f2df38a906fa5814b50a8a895fc96"
    },
    {
      "path": "chrome_200_percent.pak",
      "size_bytes": 197089,
      "sha256": "b74ad439f3d3762657f3ba533a6af3ac63315c838ed46519891366f43d834a0e"
    },
    {
      "path": "d3dcompiler_47.dll",
      "size_bytes": 4741488,
      "sha256": "a05f99734f7c4822fefc12b367af21fd0976ed6608752fb1e1e80b6ece7ecbbb"
    },
    {
      "path": "dxcompiler.dll",
      "size_bytes": 25616896,
      "sha256": "1085707889573af5b32e7644d47a7c5f0809ed0818217d75f6eaedee37a2a767"
    },
    {
      "path": "dxil.dll",
      "size_bytes": 1509760,
      "sha256": "77e039c905030a641e53658a008b74e90635a5ea9b6b79eabd0f2003bdfca59a"
    },
    {
      "path": "electron.exe",
      "size_bytes": 225448960,
      "sha256": "67cff2ce5ac7976408aac30e17e9266443a351b44ec1ee613b444867a78dc9d7"
    },
    {
      "path": "ffmpeg.dll",
      "size_bytes": 3067904,
      "sha256": "8b7cbc841fd42443cfa4011badb5cf6b9fb41a7a2c277ccbf8e0c321ae44af37"
    },
    {
      "path": "icudtl.dat",
      "size_bytes": 10876560,
      "sha256": "bd8c145abdf3f8383276ce01dfa4ae48709bef9fef1c0711eb7c3fab4f6eb7c2"
    },
    {
      "path": "libEGL.dll",
      "size_bytes": 474624,
      "sha256": "c459e2cf46578da98ba8955e94f29fde8001ba3f44197a3ec521a9c91b538e7c"
    },
    {
      "path": "libGLESv2.dll",
      "size_bytes": 8023552,
      "sha256": "39955886b88e2c2978c8472225430c497abf90b1fad906d7b3b6fdf581ce9ddf"
    },
    {
      "path": "locales/af.pak",
      "size_bytes": 613722,
      "sha256": "e16a85aae42dd387971140f0bcea4ad9c25c5f1d06407e7e46cc549241db0d58"
    },
    {
      "path": "locales/am.pak",
      "size_bytes": 994404,
      "sha256": "03fa71456bbb5e88694a519adc8f8ec9ebfdaaf4ecd8f381343f15a1805e3afb"
    },
    {
      "path": "locales/ar.pak",
      "size_bytes": 1095898,
      "sha256": "e952c3a544f0b91cf26e91c8c7a763755cca9591aa915a9d3e63a6cf6daacf6a"
    },
    {
      "path": "locales/bg.pak",
      "size_bytes": 1137844,
      "sha256": "889c68ea8206027dcebd1835884eff52f53c59dfb00fa112c43a2fbb87083ce7"
    },
    {
      "path": "locales/bn.pak",
      "size_bytes": 1460793,
      "sha256": "1b3cb0d1ac1627b51b3a208f3f29864bf415bff3d1d0d5a8b84e7ae4ab2455b4"
    },
    {
      "path": "locales/ca.pak",
      "size_bytes": 691926,
      "sha256": "5da35ba1fb3132d4725bb32d1b1c2a5703ac86effb7ef294470b73887e27b663"
    },
    {
      "path": "locales/cs.pak",
      "size_bytes": 718396,
      "sha256": "0d6a7d8bb08c1c6b8a4735fb364bf7b81b66797e48ea34ef06f78c9d87d15f26"
    },
    {
      "path": "locales/da.pak",
      "size_bytes": 644425,
      "sha256": "73e7ff20f472675b6fe5be87535563ea19fda72dddc64d5e0f068211dfee3703"
    },
    {
      "path": "locales/de.pak",
      "size_bytes": 693010,
      "sha256": "99c50acbe4dca9edde03189ed793f8d6f000793f0938320a39370a11855544f4"
    },
    {
      "path": "locales/el.pak",
      "size_bytes": 1250786,
      "sha256": "e580ee2585ae5f5e9d3cc874c2f1b3773861db3493ae7c08d5c1a3bd4bacbc66"
    },
    {
      "path": "locales/en-GB.pak",
      "size_bytes": 559609,
      "sha256": "bc3c6c433ad7fa76df796fd37d413889be6d2e2759d54680dc3549a0b1bd99f9"
    },
    {
      "path": "locales/en-US.pak",
      "size_bytes": 565800,
      "sha256": "39d605d22eb267d68ea4268d5e2a38a88ec0e2ed6dec23395a7da47f99c58184"
    },
    {
      "path": "locales/es-419.pak",
      "size_bytes": 682813,
      "sha256": "7a30d5e3ae178d15384cd7fff6aea467fa938c6261cab11fa870a3dff84e4df8"
    },
    {
      "path": "locales/es.pak",
      "size_bytes": 679423,
      "sha256": "7d92ead9e4168f52274e3729457adf50d896d0fde01aecd873d6e0122744f954"
    },
    {
      "path": "locales/et.pak",
      "size_bytes": 620125,
      "sha256": "dad68aad8c36da532a58f018124d4182173b2589f6f8c44cdd3f7dbb5304ee68"
    },
    {
      "path": "locales/fa.pak",
      "size_bytes": 1026720,
      "sha256": "b88eb1d00a6bd70c969a44c57f2fce5760001d16713a43288595c2efd43c3247"
    },
    {
      "path": "locales/fi.pak",
      "size_bytes": 632141,
      "sha256": "cd1a5e8b30a1a0e8a35830174e66c89d21dde97614a93749eedabd3731516f0d"
    },
    {
      "path": "locales/fil.pak",
      "size_bytes": 715474,
      "sha256": "6c86424d7415a92456ebf6d7a17b1e4cfcfb25da833a4c5377c502c24e335ff8"
    },
    {
      "path": "locales/fr.pak",
      "size_bytes": 738084,
      "sha256": "92fdf24ee5cd7977dae8940c092f743683278432a7dd68a52a5c069f32f60d7a"
    },
    {
      "path": "locales/gu.pak",
      "size_bytes": 1443467,
      "sha256": "dae744e959d1a536cd51e925f2aa80b7ba23f981a989368b9b6f87df03194627"
    },
    {
      "path": "locales/he.pak",
      "size_bytes": 898516,
      "sha256": "fc4011bf24266691363cfecd0a0c233f3197c9706bb0c5ede73cbc25a8f71e97"
    },
    {
      "path": "locales/hi.pak",
      "size_bytes": 1529365,
      "sha256": "0f78af66fa88302da0e1241175abe0291512c32521792adab5efd67c6196fca5"
    },
    {
      "path": "locales/hr.pak",
      "size_bytes": 690892,
      "sha256": "24c82c47f0bd227e91a83a5d3f929ba5f557a0a262b3b7293f7941faa3b45941"
    },
    {
      "path": "locales/hu.pak",
      "size_bytes": 738244,
      "sha256": "0bed3bc4d3258dbbcdfd4a2479c666d35aa2eb2794127c7135067f650bb50455"
    },
    {
      "path": "locales/id.pak",
      "size_bytes": 612159,
      "sha256": "bb63434850472affa79247d4b79465b89fc4ebd290478015e88d04be55d4c276"
    },
    {
      "path": "locales/it.pak",
      "size_bytes": 668936,
      "sha256": "a4990034b1e74404b83e9578016ff7fd81468f62ecfde48bec4e3a05df782b40"
    },
    {
      "path": "locales/ja.pak",
      "size_bytes": 815268,
      "sha256": "61000f96276079f74db0fde6b8294324811f271fee2835917c42312ac9b7b0b5"
    },
    {
      "path": "locales/kn.pak",
      "size_bytes": 1661406,
      "sha256": "41a2028199741a4827bc470772aead42276cf630aad61e344191d4708cff6bb0"
    },
    {
      "path": "locales/ko.pak",
      "size_bytes": 693731,
      "sha256": "2d77980cb8d944305ed6b2dd4413862e205bce2de4b3a1eedacfc91e1836999f"
    },
    {
      "path": "locales/lt.pak",
      "size_bytes": 751706,